{
  "name": "Barriss Offee",
  "height": "166",
  "mass": "50",
  "hair_color": "black",
  "skin_color": "yellow",
  "eye_color": "blue",
  "birth_year": "40BBY",
  "gender": "female",
  "homeworld": "https://sw-api.sivaramp.com/api/planets/51",
  "films": ["https://sw-api.sivaramp.com/api/films/5"],
  "species": ["https://sw-api.sivaramp.com/api/species/29"],
  "vehicles": [],
  "starships": [],
  "created": "2014-12-20T16:46:40.440000Z",
  "edited": "2014-12-20T21:17:50.457000Z",
  "url": "https://sw-api.sivaramp.com/api/people/65"
}
