{
  "name": "Mace Windu",
  "height": "188",
  "mass": "84",
  "hair_color": "none",
  "skin_color": "dark",
  "eye_color": "brown",
  "birth_year": "72BBY",
  "gender": "male",
  "homeworld": "https://sw-api.sivaramp.com/planets/42",
  "films": [
    "https://sw-api.sivaramp.com/films/4",
    "https://sw-api.sivaramp.com/films/5",
    "https://sw-api.sivaramp.com/films/6"
  ],
  "species": [],
  "vehicles": [],
  "starships": [],
  "created": "2014-12-20T10:12:30.846000Z",
  "edited": "2014-12-20T21:17:50.420000Z",
  "url": "https://sw-api.sivaramp.com/people/51"
}
