{
  "name": "Leia Organa",
  "height": "150",
  "mass": "49",
  "hair_color": "brown",
  "skin_color": "light",
  "eye_color": "brown",
  "birth_year": "19BBY",
  "gender": "female",
  "homeworld": "https://swapi.info/api/planets/2",
  "films": [
    "https://swapi.info/api/films/1",
    "https://swapi.info/api/films/2",
    "https://swapi.info/api/films/3",
    "https://swapi.info/api/films/6"
  ],
  "species": [],
  "vehicles": ["https://swapi.info/api/vehicles/30"],
  "starships": [],
  "created": "2014-12-10T15:20:09.791000Z",
  "edited": "2014-12-20T21:17:50.315000Z",
  "url": "https://swapi.info/api/people/5"
}
