{
  "name": "Cord√©",
  "height": "157",
  "mass": "unknown",
  "hair_color": "brown",
  "skin_color": "light",
  "eye_color": "brown",
  "birth_year": "unknown",
  "gender": "female",
  "homeworld": "https://sw-api.sivaramp.com/api/planets/8",
  "films": ["https://sw-api.sivaramp.com/api/films/5"],
  "species": [],
  "vehicles": [],
  "starships": [],
  "created": "2014-12-20T11:11:39.630000Z",
  "edited": "2014-12-20T21:17:50.449000Z",
  "url": "https://sw-api.sivaramp.com/api/people/61"
}
