{
  "name": "Nien Nunb",
  "height": "160",
  "mass": "68",
  "hair_color": "none",
  "skin_color": "grey",
  "eye_color": "black",
  "birth_year": "unknown",
  "gender": "male",
  "homeworld": "https://sw-api.sivaramp.com/api/planets/33",
  "films": ["https://sw-api.sivaramp.com/api/films/3"],
  "species": ["https://sw-api.sivaramp.com/api/species/10"],
  "vehicles": [],
  "starships": ["https://sw-api.sivaramp.com/api/starships/10"],
  "created": "2014-12-18T11:26:18.541000Z",
  "edited": "2014-12-20T21:17:50.371000Z",
  "url": "https://sw-api.sivaramp.com/api/people/31"
}
