{
  "name": "Owen Lars",
  "height": "178",
  "mass": "120",
  "hair_color": "brown, grey",
  "skin_color": "light",
  "eye_color": "blue",
  "birth_year": "52BBY",
  "gender": "male",
  "homeworld": "https://swapi.info/api/planets/1",
  "films": [
    "https://swapi.info/api/films/1",
    "https://swapi.info/api/films/5",
    "https://swapi.info/api/films/6"
  ],
  "species": [],
  "vehicles": [],
  "starships": [],
  "created": "2014-12-10T15:52:14.024000Z",
  "edited": "2014-12-20T21:17:50.317000Z",
  "url": "https://swapi.info/api/people/6"
}
