{
  "name": "Dooku",
  "height": "193",
  "mass": "80",
  "hair_color": "white",
  "skin_color": "fair",
  "eye_color": "brown",
  "birth_year": "102BBY",
  "gender": "male",
  "homeworld": "https://sw-api.sivaramp.com/api/planets/52",
  "films": [
    "https://sw-api.sivaramp.com/api/films/5",
    "https://sw-api.sivaramp.com/api/films/6"
  ],
  "species": ["https://sw-api.sivaramp.com/api/species/1"],
  "vehicles": ["https://sw-api.sivaramp.com/api/vehicles/55"],
  "starships": [],
  "created": "2014-12-20T16:52:14.726000Z",
  "edited": "2014-12-20T21:17:50.462000Z",
  "url": "https://sw-api.sivaramp.com/api/people/67"
}
