{
  "name": "Gregar Typho",
  "height": "185",
  "mass": "85",
  "hair_color": "black",
  "skin_color": "dark",
  "eye_color": "brown",
  "birth_year": "unknown",
  "gender": "male",
  "homeworld": "https://sw-api.sivaramp.com/planets/8",
  "films": ["https://sw-api.sivaramp.com/films/5"],
  "species": [],
  "vehicles": [],
  "starships": ["https://sw-api.sivaramp.com/starships/39"],
  "created": "2014-12-20T11:10:10.381000Z",
  "edited": "2014-12-20T21:17:50.445000Z",
  "url": "https://sw-api.sivaramp.com/people/60"
}
