{
  "name": "Ratts Tyerel",
  "height": "79",
  "mass": "15",
  "hair_color": "none",
  "skin_color": "grey, blue",
  "eye_color": "unknown",
  "birth_year": "unknown",
  "gender": "male",
  "homeworld": "https://sw-api.sivaramp.com/planets/38",
  "films": ["https://sw-api.sivaramp.com/films/4"],
  "species": ["https://sw-api.sivaramp.com/species/16"],
  "vehicles": [],
  "starships": [],
  "created": "2014-12-20T09:53:15.086000Z",
  "edited": "2014-12-20T21:17:50.410000Z",
  "url": "https://sw-api.sivaramp.com/people/47"
}
