{
  "name": "Shaak Ti",
  "height": "178",
  "mass": "57",
  "hair_color": "none",
  "skin_color": "red, blue, white",
  "eye_color": "black",
  "birth_year": "unknown",
  "gender": "female",
  "homeworld": "https://sw-api.sivaramp.com/api/planets/58",
  "films": [
    "https://sw-api.sivaramp.com/api/films/5",
    "https://sw-api.sivaramp.com/api/films/6"
  ],
  "species": ["https://sw-api.sivaramp.com/api/species/35"],
  "vehicles": [],
  "starships": [],
  "created": "2014-12-20T18:44:01.103000Z",
  "edited": "2014-12-20T21:17:50.486000Z",
  "url": "https://sw-api.sivaramp.com/api/people/78"
}
